carimbo de datahora,eixo tematico,titulo do trabalho,resumo,palavrachave 1,palavrachave 2,palavrachave 3,palavrachave 4,palavrachave 5
04042023 225856,eixo tematico 2  o professor a docencia e as suas praticas pedagogicas no contexto das tdic,narrativas digitais como possibilidade de construcao de saberes na educacao a distancia a nova arte de contar historias,o novo cenario da educacao e as transformacoes as quais vem passando traz a necessidade de estudos que averiguem novas formas de ensinoaprendizagem principalmente sobre a insercao de tecnologias digitais nos espacos educativos assim e fundamental a aplicacao de metodologias que despertem habilidades nos aprendizes autonomia criticidade proatividade a partir de praticas pedagogicas que valorizem suas percepcoes impressoes e leitura de mundo convertendoos em autor de seu percurso de aprendizagem dando mais significado ao processo nesse intuito essa pesquisa visa a investigacao das narrativas digitais como uma possibilidade metodologica aplicavel ao contexto da educacao a distancia ead na promocao de uma aprendizagem significativa para tanto buscarsea teorizar as narrativas digitas sugerindose a aplicacao da metodologia em um curso de formacao docente em ead provocando reflexoes das praticas pedagogicas com isso esperase o desenvolvimento de contextos significativos de aprendizagem  aprofundamento teorico sobre narrativas digitais para a pratica docente articulando a pesquisa ao processo subsidiando outras pesquisas alem de gerir didaticamente materiais que contribuam para a formacao de docentespesquisadores,narrativas digitais,tecnologias digitais,educacao a distancia,formacao docente,nd
04042023 225943,eixo tematico 2  o professor a docencia e as suas praticas pedagogicas no contexto das tdic,nivel de proficiencia digital docente a partir do quadro europeu de competencia digital para educadores,a competencia digital docente e um assunto que tem se despertado no seculo xxi em razao das tecnologias digitais de informacao e comunicacao tdic nesse contexto este trabalho e parte de uma pesquisa em andamento que objetiva avaliar o nivel de proficiencia digital dos docentes de uma faculdade publica de cruzeiro cidade do vale paraiba interior de sao paulo para tanto sera utilizado como referencia o quadro europeu de competencia digital para educadores digicompedu que contempla seis areas de investigacao envolvimento profissional recursos digitais avaliacao ensino e aprendizagem capacitacao dos aprendentes e promocao da competencia digital dos aprendentes pretendese entao a aplicacao de um questionario com perguntas fechadas para posterior analise do nivel de proficiencia digital predominante da amostra pesquisada dentre os possiveis recemchegadas exploradores integradores especialistas lideres e pioneiros acreditase que os resultados a serem obtidos trarao desmembramentos importantes para instituicao ao passo que fornecera um diagnostico do corpo docente e podera direcionar acoes que visem a capacitacao docente para eventual progressao de nivel,competencia digital,tdic,digicompedu,ensino superior tecnologico,nd
04042023 230032,eixo tematico 2  o professor a docencia e as suas praticas pedagogicas no contexto das tdic,o ensino de fisica durante as aulas remotas,durante a pandemia de covid19 fezse necessario a estipulacao do ensino remoto no qual os alunos teriam acesso as aulas e conteudos curriculares de suas grades de ensino atraves da internet e os professores preparariam esses materiais e ministrariam as aulas de suas casas este trabalho referese a uma pesquisa de estagio realizada durante o curso de licenciatura em fisica da universidade federal de sao carlos na qual buscase apresentar as dificuldades encontradas pelos professores de ciencias da natureza em especial de fisica do ensino medio para se adaptar a este ensino remoto para tanto foi realizado um questionario virtual com quatro professores da rede publica e privada e as respostas foram analisadas segundo a analise de conteudo de bardin 1977 segundo nossas analises foi possivel concluir que a passagem das aulas presenciais ao ensino remoto foi um periodo conturbado para os professores porem estes conseguiram se adaptar e ainda otimizar a oportunidade do uso de tecnologias em suas aulas,ensino remoto,covid19,professores de ciencias,adaptacao,nd
04042023 230154,eixo tematico 2  o professor a docencia e as suas praticas pedagogicas no contexto das tdic,o ensino hibrido como metodologia ativa para o reforco do ensino da leitura na educacao basica  fundamental ii e ensino medio,resumo falar sobre o impacto da leitura para a melhoria do processo de ensinoaprendizagem em especial na educacao basica mostrase como essencial pois a leitura foi e e sempre sera um tema a ser explorado por varios autores durante decadas e ate seculos como uma pratica fundamental para a melhoria da qualidade do ensino em todas as modalidades assim sendo o objetivo deste artigo e pesquisar e entender como a tecnologia digital pode ser usada como metodologia ativa para promover a melhoria da qualidade do ensino da leitura na educacao basica destacando o ensino fundamental ii e ensino medio a escola precisa articular estrategias didaticas para fortalecer a pratica da leitura nao so na rotina escolar presencial como tambem na rotina escolar remota que se estabeleceu nas escolas nos ultimos 2 dois anos em virtude do isolamento social por causa da pandemia covid19 repensar a pratica de leitura utilizandose dos recursos tecnologicos disponiveis e de ferramentas como blog youtube instagram google meet zoom emal skype whatsapp google classroom pode ser uma maneira de amenizar essa defasagem na aprendizagem da leitura e na autonomia leitora atraves do ensino hibrido ou seja uma soma de aula presencial e o reforco escolar por meio de deveres de casa online,pratica da leitura,ensino hibrido,metodologia ativa,tecnologia da informacao e comunicacao,transposicao didatica
04042023 230312,eixo tematico 2  o professor a docencia e as suas praticas pedagogicas no contexto das tdic,o ensino remoto emergencial dramaticas de uso de si do professor,com vistas a problematizar as dramaticas de uso de si do professor na transposicao do ensino
presencial para o ensino remoto emergencial e o uso das tecnologias da informacao e comunicacao
tic esta reflexao tem como objetivo apresentar as ideias iniciais de uma investigacao que visa
verificar o impacto provocado pela pandemia do novo coronavirus covid19 na atividade de trabalho
docente no que tange ao referencial teorico esta reflexao parte dos estudos da perspectiva dialogica
da linguagem bakhtin 2016 volochinov 2017 e estabelece interlocucao com a abordagem
ergologica schwartz 2006 2014 2016 focalizando a atividade docente por meio dos discursos que
emergem do espaco de fala criado em situacao de entrevista entendese que o processo de
transposicao da pratica docente presencial para um ambiente de virtualidade pode ser estudado a
partir das construcoes dialogicas sobre o trabalho de ensinar que na verbalizacao refletem e refratam
reelaboracoes e ressignificacoes laborais,atividade docente,ensino remoto emergencial,tecnologias da informacao e comunicacao,dramaticas de uso de si,nd
04042023 230407,eixo tematico 2  o professor a docencia e as suas praticas pedagogicas no contexto das tdic,oferta de disciplinas de teclado na licenciatura em musica da ufscar durante a pandemia de covid19,o presente artigo traz reflexoes a respeito do ensino e da aprendizagem musical do ponto de vista do professor e de seus alunos com o objetivo de descrever e analisar disciplinas obrigatorias de teclado no ambito do curso de licenciatura em musica da universidade federal de sao carlos  ufscar e estabelecer uma comparacao de suas ministracoes na modalidade presencial e na modalidade intitulada ensino nao presencial emergencial enpe instituida em decorrencia das necessidades protocolares de prevencao ao longo da pandemia de covid19 o artigo e um relato de experiencia cujos dados foram coletados a partir da observacao das interacoes observadas in loco e dos registros das interacoes entre os participantes nas situacoes observadas em um ambiente virtual de aprendizagem  ava as reflexoes consideraram as perspectivas de bondia 2002 no que tange a construcao intersubjetiva de significados que resultam em saberes da experiencia e de shulman
2004 no que diz respeito ao aprendizado continuo do professor em permanente processo os resultados mostram que a disciplina instrumento harmonico 1 aplicada no ambito do enpe dispos uma conjuntura diferenciada em relacao a modalidade presencial mas de forma geral em condicoes consideradas relativamente eficientes na perspectiva dos discentes,ensino de instrumentos de teclado,licenciatura em musica,ensino nao presencial emergencial enpe,ambiente virtual de aprendizagem ava,nd
04042023 230450,eixo tematico 2  o professor a docencia e as suas praticas pedagogicas no contexto das tdic,o estagio supervisonado no curso de pedagogia desafios e possibilidades em contexto de pandemia,compreendendo o estagio supervisionado curricular obrigatorio como um campo de conhecimento fundamental para a constituicao da pratica docente esta pesquisa busca refletir sobre as implicacoes na formacao de pedagogos do cumprimento nao presencial do estagio supervisionado no contexto de pandemia da covid19 para responder ao objetivo da pesquisa procurouse investigar trabalhos e pesquisas realizados sobre o tema estagio curricular em cursos de pedagogia nos anos de 2020 e 2021 no google academico e no site da associacao nacional de posgraduacao e pesquisa anped em termos metodologicos tratase de uma pesquisa de cunho exploratorio realizada a partir de um levantamento bibliografico de trabalhos sobre o tema em portais especializados  ressaltamos que as experiencias vivenciadas na realizacao das diferentes estrategias utilizadas para o cumprimento do estagio supervisionado curricular de forma nao presencial foram desafiadoras tanto para os professores quanto para os estudantes o que ressignificou a atuacao docente por meio de novas experiencias formativas,pandemia,estagio nao presencia,atuacao docente,experiencias formativas,nd
05042023 095525,eixo tematico 2  o professor a docencia e as suas praticas pedagogicas no contexto das tdic,oficina para professores de criacao de objetos de aprendizagem  relato de experiencia,no ambiente escolar podese utilizar ferramentas computacionais educativas para estimular o interesse no aluno e impulsionar o uso da tecnologia entretanto alguns docentes nao se sentem seguros em utilizalas pois nao tiveram uma ambientacao com tecnologias que auxiliam nos processos de ensino e aprendizagem assim este trabalho apresenta um relato de experiencia de uma oficina ministrada a professores do municipio de alegrete por meio de um projeto de extensao ofertado pelo instituto federal farroupilha e que tinha como objetivo contribuir com a formacao continuada aos docentes para o uso das tdics por meio da criacao de um objeto de aprendizagem no scratch ao finalizar a oficina aplicouse um questionario que foi discutido de maneira qualitativa e quantitativa os beneficios e o impacto desta pratica por meio das respostas coletadas do questionario destacouse que predomina entre os participantes a opiniao que os objetos de aprendizagem sao recursos atrativos e desafiadores que permitem dinamicas diversificadas,ensino,objetos de aprendizagem,professores,nd,nd
05042023 095606,eixo tematico 2  o professor a docencia e as suas praticas pedagogicas no contexto das tdic,oficinas brincadeiras musicais a formacao docente em musica nos tempos de pandemia,o presente artigo consiste em um relato de experiencia sobre as oficinas brincadeiras musicais desenvolvidas em campo de estagio supervisionado com foco na formacao para o ensino musical escolar o intuito principal deste artigo e lancar luz a algumas ideias que foram postas em pratica no curso de licenciatura em musica da universidade estadual de londrina no ano de 20202021 em resposta a necessidade de distanciamento social ocasionada pela pandemia de covid19 as tecnologias digitais viabilizaram a realizacao das oficinas em formato remoto via google meet participaram das oficinas professores da educacao infantil que foram convidados a vivenciar a musica por meio da voz dos gestos e dos movimentos e a conhecer brincadeiras musicais que poderiam ser levadas para sala de aula as atividades propostas tiveram por base o repertorio do projeto musica crianca vinculado a mesma universidade e voltado a producao de musica para o publico infantil as acoes dos participantes observadas durante as oficinas assim como seus depoimentos orais e escritos mostraram que houve a apreensao dos conteudos musicais e das estrategias pedagogicas abordadas,formacao docente,ensino musical escolar,ensino remoto,pandemia de covid19,nd
05042023 095647,eixo tematico 2  o professor a docencia e as suas praticas pedagogicas no contexto das tdic,o percurso formativo dos professores da rede municipal de balsas para implantacao do ensino hibrido na educacao basica,o presente estudo aborda sobre o percurso formativo dos professores da rede municipal do ensino fundamental de balsas  maranhao com vistas a implantacao do ensino hibrido em todas as escolas do ensino fundamental tratase de um estudo exploratoriodescritivo de natureza qualitativa que visa obter informacoes sobre a motivacao e as competencias desenvolvidas pelos professores da rede municipal de balsas durante o processo de formacao sob a responsabilidade da universidade
estadual do maranhao uema por meio do seu nucleo de tecnologias para educacao  uemanet a analise desse contexto pautouse nos dados e informacoes coletadas no ava e nos relatorios da equipe de design educacional e dos professores mediadores ancorada em autores renomados com estudos e pesquisas desenvolvidas recentemente sobre a tematica em apreco os resultados indicam a necessidade e urgencia de se pensar a formacao dos professores nesse novo contexto pedagogico uma vez que o ensino hibrido nao pode ser confundido como uma modalidade de educacao mas numa perspectiva metodologica flexivel com a mediacao das tecnologias digitais integrando ensino presencial e a distancia,educacao hibrida,formacao de professores,uso das tdic,nd,nd
05042023 095722,eixo tematico 2  o professor a docencia e as suas praticas pedagogicas no contexto das tdic,o uso de tecnologias por professores estudo de caso em uma escola,este trabalho se trata de um estudo de caso sobre o uso de tecnologia no ensino no ano de 2019 o objetivo do trabalho foi avaliar o uso de tecnologia por um grupo de 18 professores de uma escola pei do interior do estado de sao paulo e identificar se ha relacao entre o desenvolvimento profissional docente segundo huberman1992 autor de referencia deste trabalho e o uso de tecnologia no ensino atraves do uso de questionario os 18 professores responderam sobre seus conhecimentos de tecnologias digitais e quais delas faziam parte de sua pratica de ensino notouse no trabalho que os professores do estudo de caso tinham interesse pedagogico nas ferramentas digitais usadas para o preparo de aula e em interacao com os alunos e que o desenvolvimento profissional nao esta ligado ao tempo de dedicacao dos professores a vida docente dos 18 professores 3 dos mais experientes e que estao na fase final de carreira sao professores ativos na busca de ferramentas tecnologicas conhecem e usam ferramentas como podcast e jogos online portanto a analise dos resultados nao encontrou paralelo com a teoria de huberman 1992,tecnologia,pratica docente,nativos digitais,nd,nd
05042023 095807,eixo tematico 2  o professor a docencia e as suas praticas pedagogicas no contexto das tdic,os desafios da educacao infantil diante da pandemia de covid19 e do ensino remotohibrido,resumo na educacao ao se adotar medidas de isolamento social foi necessario a suspensao dos atendimentos presenciais nas escolas da educacao basica criando grande impacto nos processos formativos em criancas de 0 a 6 anos na rme de sao paulo a suspensao das aulas foi oficializada por meio da resolucao do cme n 022020 e do decreto 592832020 ao todo nos diversos campos de atuacao da administracao publica foram elaborados 36 normativas entre portarias resolucoes e instrucoes voltadas para a orientacao do processo pandemico o presente estudo se propos a explorar e analisar os conteudos das referidas normativas buscando sistematizalas em duas categorias 1 administrativa e 2 pedagogica este e um estudo qualitativo de base documental e esta amparado nas discussoes de campos 2006 salomao 2021 e scavone 2011 os resultados indicam tendencia nas orientacoes para enfrentamento do novo normal que podem sugerir que o pedagogico foi negligenciado pois na impossibilidade de uma aproximacao junto aos segmentos que compoem a comunidade escolar enfraqueceu a elaboracao dos documentos pedagogicos e na proposicao de acoes vividas nos cotidianos das escolas,educacao infantil,normativas,covid19,ensino hibrido,nd
05042023 095921,eixo tematico 2  o professor a docencia e as suas praticas pedagogicas no contexto das tdic,o trabalho docente mediado pelas tecnologias digitais na formacao inicial de professores uma visao critica,o presente estudo tem como tema o trabalho docente mediado pelas tecnologias digitais na formacao inicial de professores na universidade universidade estadual de goias ueg em especifico o estudo busca tracar e analisar de forma critica o trabalho docente dos professores dos cursos de licenciaturas da ueg unidades de anapolisgo mediado pelo uso das tecnologias para compreender a constituicao dessa relacao o objetivo da pesquisa e compreender como tem ocorrido o trabalho docente mediado pelas tecnologias digitais na formacao inicial de professores sob uma visao critica nos cursos de licenciatura da ueg o levantamento dos dados se dara apos a revisao de literatura pesquisa documental como ementas e planos de ensino das disciplinas especificas para a formacao de professores a pesquisa em andamento ocorrera por meio de entrevistas semiestruturadas com os professores responsaveis por ministrar as disciplinas pedagogicas nos cursos de licenciatura a pesquisa com base no aporte teorico se faz relevante por se ter estudos anteriores pautados nas tecnologias como centro e acreditamos que olhar apenas os objetos nao e o suficiente para compreender a complexidade do trabalho docente mediado pelas tecnologias mas tambem o sujeito e os contextos dos quais eles fazem parte,tecnologia,educacao,trabalho docente,nd,nd
05042023 100038,eixo tematico 2  o professor a docencia e as suas praticas pedagogicas no contexto das tdic,pensamento computacional na formacao de professores de ciencias do ensino fundamental,o pensamento computacional pc ja e uma realidade no curriculo da educacao basica de diversos
paises do mundo no brasil conhecimento competencias e habilidades relacionados ao pc estao
mencionados na base nacional comum curricular bncc e vem impactando o modo de aprender e
resolver problemas diante desse contexto e requerido de professores de diferentes areas de
conhecimentos habilidades nas competencias digitais e nos fundamentos da computacao a partir do
avanco da computacao nas diversas praticas de ensino desenvolvemos uma pesquisa de doutorado
em andamento que utiliza o pc como estrategia de aprendizagem na formacao de professores no
ensino de ciencias neste artigo e apresentada esta pesquisa de doutorado que tem como o objetivo
utilizar os conceitos de pc aplicados no ensino de ciencias o resultado sera o desenvolvimento de um
produto educacional para ser utilizado no processo formativo para professores,formacao de professores,ensino de ciencias,pensamento computacional,nd,nd
05042023 100124,eixo tematico 2  o professor a docencia e as suas praticas pedagogicas no contexto das tdic,pensando uma comunidade de dialogo pratica e teorizacao acerca da experimentacao em ciencias com o auxilio dos rea a partir dos diagramas rda,diante do novo cenario pospandemico a educacao encontrase em pleno processo de reflexao buscando compreensoes do que foi produzido durante o periodo pandemico da covid19 desta forma este estudo tem por objetivo compreender o processo da indagacao online desenvolvida numa disciplina curricular da posgraduacao atraves da elaboracaocriacao da representacao de um cenario educacional com o uso de rea na experimentacao em ciencias a partir dos diagramas rda o percurso metodologico do estudo configurase como uma pesquisa de abordagem qualitativa do tipo teorica de objetivo exploratorio amparado em termos de procedimentos tecnicos na analisecotejamento de fontes bibliograficas e documentais produzidas por professores e estudantes do componente curricular e possivel inferir da investigacao que o substrato base gerado pelos rea com a devida modelagem via diagramas rda fornece uma ambiencia adequada para a estruturacao e execucao de um processo dialogico de indagacao em cenarios educacionais online viabilizando a concretizacao de uma comunidade de dialogo pratica e teorizacao na experimentacao em ciencias,desenho didatico,indagacao online,praticas pedagogicas,pesquisaformacao,nd
05042023 100155,eixo tematico 2  o professor a docencia e as suas praticas pedagogicas no contexto das tdic,percepcoes de professores do ensino fundamental sobre o uso das tecnologias de comunicacao e informacao tics durante a pandemia do coronavirus,resumo as transformacoes sociais sao constantes cabendo a sociedade adaptarse entretanto na educacao ha uma disparidade entre as tecnologias tornandose necessario compreender a visao de professores sobre a implementacao das tics na educacao durante a pandemia do coronavirus esta tornouse uma discussao relevante pois foi unico recurso possivel a ser utilizado pelo distanciamento social exigido pela pandemia assim a presente pesquisa e de carater bibliografico como tambem contou com a aplicacao de questionario a professores do ensino fundamental i da regiao do vale do aco em minas gerais sendo assim identificase que o primeiro entrave e a diferenca cultural entre professores e alunos quanto ao uso das tecnologias logo concluise que fator significativo foi a relacao de geracoes dos professores entrevistados,ensinoaprendizagem,professores,tecnologia,nd,nd
05042023 100242,eixo tematico 2  o professor a docencia e as suas praticas pedagogicas no contexto das tdic,percurso de formacao docente para atuar na ead,resumo para subsidiar a pratica docente na ead e necessario que o professor adquira eou aprimore competencias didaticas pedagogicas e digitais desse modo o objetivo do presente trabalho e descrever o delineamento do curso de formacao docente em ead considerando os objetivos a estrutura modular os topicos de conteudo a metodologia e o processo de avaliacao o referido curso foi estruturado em tres modulos 1 aportes conceituais e desenho institucional e pedagogico da ead na ufrn 2 organizacao didaticopedagogica da acao docente 3 o moodle mandacaru como espaco de atuacao docente das ferramentas a abordagens metodologicas os modulos foram ministrados sincronicamente atraves do google meet com duracao de 3 horas cada e em 3 dias consecutivos finalizada a etapa sincrona os docentes participaram dos momentos assincronos durante 30 dias no ambiente virtual de aprendizagem foram disponibilizadas bibliografias complementares e foruns de comunicacao para que os participantes pudessem sanar duvidas apos a etapa sincrona o processo de a avaliacao da formacao docente foi processual considerando a participacao do cursista nos foruns a natureza das questoes por ele formuladas e o feedback obtido no encerramento do curso em termos de avaliacao quanto ao conteudo a metodologia e as contribuicoes da formacao pra a atuacao docente em ead,formacao de professores,planejamento,pratica docente,nd,nd
05042023 100322,eixo tematico 2  o professor a docencia e as suas praticas pedagogicas no contexto das tdic,plataformizacao docente uma investigacao sobre o trabalho docente mediado pelas tecnologias na pandemia covid19,as consequencias da pandemia da covid19 se espraiaram para as mais diversas areas e uma das
mais afetadas de acordo com a unesco foi a educacao cuja manutencao formal estimulou praticas
de ensino e aprendizagem atinentes ao ensino remoto emergencial ere tal alternativa nao evitou
forte impacto nas relacoes entre docentes discentes e os recursos e aparatos tecnologicos a pandemia
acelerou e complexificou nosso adentar ao imperio da logica da tecnologia algoritmica que velozmente
penetrou os ambientes domesticos escolares e profissionais sob tal contexto a hipotese que orienta
a proposta de investigacao e a de que o impacto proporcionado pela pandemia no campo educacional
afetou e alterou o trabalho e a pratica docente e consequentemente revelou modificacoes nas relacoes
pedagogicas entre professores e alunos permeados pelas chamadas inovacoes pedagogicas ere e
tdic que contribuiram para que a demanda atual por formacao educacional tecnologica se
intensificasse sendo assim esta pesquisa pretende averiguar empirica e teoricamente as
transformacoes exigidas ao trabalho docente associadas as demandas de inovacao em termos de
praticas pedagogicas em especial aquelas voltadas ao trabalho mediado por plataformas o qual
estamos denominando de plataformizacao do trabalho docente,inovacao pedagogica,plataformizacao,trabalho docente,pandemia covid19,nd
