carimbo de datahora,eixo tematico,titulo do trabalho,resumo,palavrachave 1,palavrachave 2,palavrachave 3,palavrachave 4,palavrachave 5
04042023 211859,eixo tematico 2  o professor a docencia e as suas praticas pedagogicas no contexto das tdic,como docentes da rede publica municipal estadual e federal utilizaram a sala de aula do google meet no ensino remoto,resumo o presente artigo buscou relatar a experiencia de docentes da rede publica municipal estadual e federal na utilizacao da sala de aula virtual do google meet no ensino remoto durante a pandemia covid19 nos anos de 20202021 em tres instituicoes de ensino a relevancia do trabalho se justifica pela necessidade de socializacao nao apenas aos profissionais da educacao mas a toda a comunidade escolar e demais interessados a fim de expor como quando e por que aconteceram a utilizacao dessa sala de aula virtual do google meet em detrimento aos efeitos da pandemia em tres esferas distintas da educacao escolar do pais o relato de experiencia e um tipo de registro de informacoes que versa sobre situacoes e casos relevantes que ocorreram durante determinado acontecimento ou pratica profissional e baseiase no diario de bordo dos docentes pesquisadores a pesquisa mostrou que o google meet se destacou como uma tecnologia muito importante na pandemia servindo como sala de aula virtual durante o ensino remoto emergencial todavia de acordo com os relatos notouse que ha um despreparo dos docentes e pouco investimento dos estados e municipios em ofertar uma capacitacao condizente com a necessidade formativa dos docentes,google meet,relato de experiencia,pandemia,ensino remoto,docencia
04042023 212006,eixo tematico 2  o professor a docencia e as suas praticas pedagogicas no contexto das tdic,contratempo pandemico e a participacao dos alunos no ensino remoto a percepcao docente acerca da tematica,este artigo tem por objetivo verificar a partir da percepcao docente a participacao de alunos da educacao infantil ate o ensino fundamental ll de escolas publicas e privadas durante a vigencia do ensino remoto em meio a crise mundial estabelecida pelo contexto pandemico da covid19 surgiu o ensino remoto pela necessidade de retomada das atividades escolares as quais foram mediadas por tecnologias digitais da informacao e comunicacao tdic para tanto elaboramos questoes disponibilizadas por formulario online google forms enviado pelo aplicativo whatsapp as questoes alem de abordarem a participacao dos alunos nas aulas remotas sob a percepcao docente tambem buscaram tracar o perfil do professor participante da pesquisa os dados da pesquisa indicam que a maioria dos professores teve ate 50 frequencia trazendo a inquietacao essa informacao reflete participacao efetiva por parte dos educandos de modo a apoiar a construcao de saberes nossa intencao e apresentar o cenario da pesquisa e fazer reflexoes sobre o ensino remoto desses estudantes e pensar sobre o papel da tdic na educacao entendendo o papel social que exerce,tdic,ensino remoto,frequencia escolar,educacao basica,nd
04042023 212052,eixo tematico 2  o professor a docencia e as suas praticas pedagogicas no contexto das tdic,compartilhamento de saberes e experiencias durante curso para o uso de recursos tecnologicos na educacao,a projecao que o uso de tecnologias principalmente as tecnologias digitais da informacao e da comunicacao tiveram nos dois ultimos anos foi substancial com isso o olhar sobre a importancia de refletir sobre a pratica pedagogica diante das tecnologias e formacao continuada foi e e uma consequencia aliado a isso realizouse um curso de extensao voltado principalmente para professores e estudantes de licenciaturas o curso recursos tecnologicos para uma educacao atual teve por intuito maximizar a formacao teorica e pratica de seus estudantes para atuacao na educacao diante das especificidades e necessidades tecnologicas por isso este trabalho como relato de experiencia tem como proposta descrever o uso dos recursos tecnologicos e compartilhamento de saberes e experiencias durante o curso de extensao as aulas aconteceram via google meet encontros virtuais semanais com atividades direcionadas que acontecerao paralelamente de forma sincrona e assincrona foram ofertadas duas turmas para realizacao deste curso com carga horaria de 40horasaulas com encontros sincronos e assincronos no ano de 2021 em sintese identificamos um saldo positivo ao termino dos cursos ao compreender que o compartilhamento de saberes e experiencias com uso de tecnologias fez diferenca na aprendizagem e no refazer da pratica pedagogica,tecnologia educacional,recurso tecnologico,formacao continuada,nd,nd
04042023 212135,eixo tematico 2  o professor a docencia e as suas praticas pedagogicas no contexto das tdic,contribuicoes do programa hibrido de mentoria phm para a aprendizagem da docencia de professoras iniciantes,este estudo teve como objetivo apresentar as contribuicoes do programa hibrido de mentoria phm para a aprendizagem da docencia de professoras iniciantes o phm e um programa de inducao a docencia que visa oferecer acompanhamento e apoio no inicio da docencia na conducao mentoria um professor experiente com mais de 10 anos de atuacao profissional acompanha professores iniciantes com no maximo cinco anos de experiencia docente auxiliandoos a desenvolver competencias profissionais em diferentes niveis de ensino os referenciais teoricos envolveram a aprendizagem da docencia e as demandas do inicio da carreira docente tratase de uma pesquisa qualitativa com analise descritiva interpretativa de narrativas digitais produzidas por meio do dialogo entre duas professoras iniciantes e suas respectivas mentoras durante o periodo aproximado de dois anos os resultados apontam que por meio de acoes de mentoria planejadas e acompanhadas pelas mentoras durante o programa as professoras iniciantes construiram conhecimentos profissionais sobre a docencia relacionados ao ensinar e ao ser professor e tais aprendizagens revelaram que programas de mentoria se constituem numa ferramenta pedagogica promissora para apoiar o desenvolvimento profissional docente de professores iniciantes,aprendizagem da docencia,professor iniciante,mentoria,nd,nd
04042023 213051,eixo tematico 2  o professor a docencia e as suas praticas pedagogicas no contexto das tdic,contribuicoes e desafios sobre as tecnologias educacionais da informacao e comunicacao tdic e a formacao docente revisao de literatura,o presente trabalho tem como objetivo analisar o uso das tecnologias educacionais da
informacao e comunicacao tdic na formacao inicial e continuada dos professores para a realizacao
desta pesquisa foram selecionadas pesquisas stricto sensu cadastradas na biblioteca digital brasileira
de teses e dissertacoes bdtd no periodo de 2016 a 2021 das vinte 20 dissertacoes encontradas
nove 9 foram descartadas pelo distanciamento da nossa pesquisa e onze 11 foram analisadas e
contribuiram com esse trabalho assim a pesquisa foi organizada com tres 3 quadros com
informacoes importantes do material analisado e divididos em tres 3 categorias de acordo com
bardin 1977 os resultados apontam para os impactos positivos da formacao docente e as
tecnologias digitais preparandoo para uma formacao com mais competencia e autonomia para
atender as demandas educacionais porem muitas vezes as tecnologias utilizadas sao insuficientes
nos cursos de formacao inicial e continuada dos professores,revisao de literatura,tecnologias digitais,formacao de professor,nd,nd
04042023 213204,eixo tematico 2  o professor a docencia e as suas praticas pedagogicas no contexto das tdic,cultura digital pandemia e educacao implicacoes para o fazer pedagogico na educacao profissional,este trabalho resulta de uma pesquisa em andamento que objetiva analisar possiveis implicacoes da
cultura digital e do ensino na pandemia sobre o fazer pedagogico dos professores do ensino basico
tecnico e tecnologico ebtt do instituto federal de sao paulo para identificar aspectos positivos e
negativos herdados deste processo sera realizada uma revisao sistematica de literatura alem de
pesquisa documental e aplicacao de questionarios e entrevistas junto aos professores ebtt do ensino
medio integrado como resultado do estudo ainda em andamento esperase contribuir para novas
pesquisas e praticas pedagogicas exitosas e contextualizadas com as demandas da sociedade atual
marcada pelas tecnologias digitais e pelas consequencias da pandemia,cultura digital,educacao,pandemia,fazer pedagogico,educacao profissional
04042023 213307,eixo tematico 2  o professor a docencia e as suas praticas pedagogicas no contexto das tdic,cultura digital resignificando metodologias de ensino,o resumo apresenta de maneira reflexiva de que modo a educacao tem se estabelecido em meio a cultura digital identificando algumas perspectivas para docencia online frente a constante transformacao no contexto educacional tomouse como ponto de partida a discussao acerca das contribuicoes das tecnologias de informacao e comunicacao para educacao destacando a necessidade de mudancas na rotina educacional com foco na interacao como procedimento metodologico utilizamos o estudo descritivo qualitativo e analise bibliografica de textos de autores que discutem sobre a tematica dialogamos com referencias centrais para tratar do referido tema como levy 2009 lopes 2012 e moran 2013 entre outros autores os resultados apontaram que as tecnologias sao recursos que podem qualificar o processo de ensino e de aprendizagem onde emerge a necessidade de estabelecer estrategias dentre elas adotar metodologias ativas de aprendizagem baseadas em atividades desafios problemas onde cada aluno aprende no seu proprio ritmo necessidade e tambem aprende com os outros em grupos e projetos com supervisao de professores orientadores,comunicacao,cultura digital,educacao,tecnologia,nd
04042023 213417,eixo tematico 2  o professor a docencia e as suas praticas pedagogicas no contexto das tdic,da aprendizagem ao processo para uma reflexao critica sobre processos educativos hibridos no contexto da enspfiocruz,apresentase aqui uma reflexao sobre o tema do hibridismo na educacao fundamentada na experiencia de construcao desenvolvimento e avaliacao de uma oficina sobre processos educativos hibridos realizada em marco de 2022 com trabalhadores e docentes da enspfiocruz a oficina foi planejada em meio a um conjunto de acoes institucionais com o objetivo de investir na formacao docente no contexto de planejamento do retorno as aulas presenciais entre essas acoes destacase a elaboracao de um documento institucional orientador sobre processos educativos hibridos com o qual vem sendo possivel refletir criticamente sobre as possibilidades de ressignificacao e aprimoramento das praticas educativas posteriores as experiencias de ensino remoto impostas pelas circunstancias sanitarias vividas desde 2020 assim como um relato de experiencia de seus autores diretamente envolvidos na elaboracao do documento orientador e na realizacao da oficina este trabalho faz uma introducao ao contexto institucional atual e aponta para as questoes pedagogicas que vem surgindo eou se destacando no ambito da formacao docente ele intenta por fim ensaiar uma reflexao critica sobre a proposta do mec de regulamentacao da aprendizagem hibrida sugerindo que a enfase deva ser dada aos processos educativos uma vez que a aprendizagem nao deve sob riscos diversos ser apartada dos seus condicionantes culturais economicos e organizacionais tampouco das intencionalidades dos sujeitos envolvidos nas acoes educativas,processos educativos hibridos,formacao docente,avaliacao,nd,nd
04042023 213500,eixo tematico 2  o professor a docencia e as suas praticas pedagogicas no contexto das tdic,de docente a discente na cibercultura experiencias de aprovacoes no mestrado em meio a pandemia de covid19,esse trabalho tem como finalidade abordar a experiencia das tres autoras que o assinam levando em consideracao que as trajetorias ora tao distantes se cruzam em uma sala de aula virtual narrase como esse espaco que distanciou fisicamente o mundo foi capaz de nos aproximar a tecnologia nesse sentido atravessou a vida academica e profissional das autoras ressinificando nao apenas o uso da tecnologia como as relacoes construidas a parir dela aterrando a discussao nos conceitos de cibercultura trabalhado por santos 2019 discentesdocentes abordado por alves 2018 e periferia por meio de fastini 2009,discentesdocentes,cibercultura,pandemia,periferia,nd
04042023 213625,eixo tematico 2  o professor a docencia e as suas praticas pedagogicas no contexto das tdic,deformacao por competencias tensionamentos para uma transformacao emancipatoria,o presente trabalho constitui uma pesquisa de mestrado em educacao em andamento no programa
de posgraduacao em educacao da universidade do estado de santa catarina tem por objetivo
analisar sobre a racionalidade que subjaz a concepcao da formacao por competencias abordada
como eixo fundante da bnc formacao inicial e bnc formacao continuada e uma pesquisa de
abordagem qualitativa por meio de analise documental e ancoragem teoricometodologica aportada
na teoria critica da sociedade a investigacao busca contribuir para desvelar o quao a padronizacao
do pensamento intencionalidade dessas politicas sob o controle da racionalidade tecnologica e
fundante na proposicao da formacao por competencias situada na abordagem de philippe perrenoud
trazido como autor ancora a orientar as concepcoes de formacao das normativas vigentes,pedagogia das competencias,formacao docente,semiformacao,racionalidade tecnologica instrumental,nd
04042023 213722,eixo tematico 2  o professor a docencia e as suas praticas pedagogicas no contexto das tdic,desafios na pandemia o uso de tecnologia de informacao e comunicacao na pratica docente,este artigo aborda o uso de tecnologias de informacao e comunicacao na pratica docente durante a pandemia da covid19 objetiva identificar os principais dispositivos e aplicativos utilizados pelos professores da rede municipal de ensino de palmaspr para o planejamento e execucao das aulas remotas emergenciais durante o periodo de pandemia de covid19 no ano de 2020 adotamos uma abordagem mista de pesquisa combinando metodos qualitativos e quantitativos o publicoalvo do estudo foram professores que atuam na rede publica municipal no ensino fundamental i e que participaram do ensino remoto emergencial em funcao da pandemia no ano de 2020 para identificar quais recursos tecnologicos digitais foram utilizados pelos professores durante o ensino remoto emergencial a pesquisa foi realizada em duas etapas a primeira com a aplicacao de um questionario e a segunda com entrevista com os professores os resultados mostraram que diferentes artefatos tecnologicos foram utilizados pelos professores para auxiliar no planejamento e aplicacao das aulas durante o periodo de aulas remotas emergenciais muitos deles sendo utilizados pela primeira vez para essa finalidade deixando claro que a partir do letramento digital as tic podem ser uma ferramenta a mais para estar incluindo nas aulas de toda a educacao basica,educacao,docente,tecnologia,nd,nd
04042023 213940,eixo tematico 2  o professor a docencia e as suas praticas pedagogicas no contexto das tdic,desafios para a realizacao do estagio supervisionado no curso de ciencias biologicas do centro de ensino e aprendizagem em rede da universidade estadual de goias frente a pandemia da covid19,a realizacao do estagio supervisionado do curso de ciencias biologicas da universidade estadual de goias de forma remota impos a necessidade de reestruturacao no planejamento para a oferta das atividades  em  formato  online  uma  vez  que  a  covid19  provocou  a  suspensao  das  atividades presenciais  nas  escolas  em  2020  e  2021  dessa  forma  buscouse  alternativas que  permitissem  ao discente vivenciar experiencias de estagio que contribuissem para sua formacao docente sobretudo considerando  os  conhecimentos  apropriados  em  disciplinas  estudadas nesse  sentido  o estagio  se desenvolveu  a  partir  do  esforco  conjunto  em  busca  de  metodologias  recursos  apropriados  bem como  ferramentas  de  comunicacao  e  interacao  que  propiciassem  maior  interacao  do  professor supervisor  de  estagio  tutoria  e  discente  a  proposta  de  realizacao  do  estagio  supervisionado  em formato  remoto  demonstrou  possibilidades  de  formacao  academica  concretas  e  aprendizagem discente desde o planejamento realizado pelos estudantes a escolha do recurso didatico a gravacao de video aulas e finalmente a elaboracao de proposta de intervencao no contexto escolar a partir de uma situacao problema hipotetica concreta os resultados demonstraram que aproximadamente 53 dos licenciandos conseguiram cumprir integralmente a carga horaria prevista para o estagio e puderam  avancar  em  sua  formacao  academica  os  47 restantes  nao  conseguiram  cumprir  as atividades propostas ou desisitiram sem sequer tentar avancar em sua formacao,estagio supervisionado,atividades remotas,formacao academica,nd,nd
04042023 214034,eixo tematico 2  o professor a docencia e as suas praticas pedagogicas no contexto das tdic,desafios percepcoes e vivencias de uma docente na pandemia whatsapp como recurso tecnologico na graduacao,este resumo traz um relato de experiencia vivenciada no ano de 2021 na universidade estadual do amazonas onde participei como professora colaboradora voluntaria na disciplina de filosofia e ciencia no curso de ciencias biologicas utilizando o whatsapp como recurso tecnologico de acesso para ministrar as aulas neste relato apresento a fundamentacao baseada em autores pesquisadores que falam sobre as tecnologias na educacao filosofia e na base nacional comum curricular bncc que amparam a discussao num primeiro momento do estudo na sequencia da proposta do trabalho esclareco que tive como objetivos o desafio de motivar a participacao da maioria dosdas academicosas promover o acesso aos conteudos trabalhar com estrategia de ensino que propiciasse o ensino e alcancar os objetivos de aprendizagem como estrategia escolhida para ministrar a disciplina utilizei o exemplo socrates como fazedor de perguntas o desafio   para todas as questoes a serem estudadas de acordo com a ementa do curso foi a busca de boas perguntas para uma aula elaborava a questao e apresentava como desafio para ser respondida para a proxima aula e assim sucessivamente neste movimento ao final do semestre tive feedbacks positivos em relacao a ampliacao da percepcao do contexto em que os participantes estavam inseridos com relacao a filosofia e a ciencia como consequencia uma da outra alcancando os objetivos de aprendizagem,tecnologia de comunicacao,perguntas,aprendizagem,nd,nd
04042023 214207,eixo tematico 2  o professor a docencia e as suas praticas pedagogicas no contexto das tdic,design de colaboracao como ampliar experiencia de atividades colaborativas em ambientes virtuais de aprendizagem,este trabalho apresenta o processo de desenvolvimento de atividade colaborativa de disciplina online em ambiente virtual de aprendizagem moodle com alunos do ensino superior de cursos presenciais sao apresentadas diferentes abordagens do design trazendo para a perspectiva educacional que pode ajudar na analise de uma experiencia colaborativa e propor aprimoramentos com destaque para o modelo addie que contribui para a organizacao em etapas e explicitacao dos processos e da intencionalidade a experiencia suscitou a importancia do desenvolvimento do design de colaboracao amparado no modelo addie como planejamento e foco no processo foi possivel identificar que pensar e elaborar o design de colaboracao impoe alguns desafios pois requer planejamento organizacao comunicacao e estruturas adequadas ao bom fluxo das informacoes do compartilhamento de ideias ainda e preciso avancar em abordagens centradas mais na intervencao sociais e na participacao dos diversos atores nas demais etapas do processo,atividade colaborativa,design de colaboracao,abordagens do design,modelo addie,nd
04042023 214307,eixo tematico 2  o professor a docencia e as suas praticas pedagogicas no contexto das tdic,dificuldades de aprendizagem reveladas em textos e o enfrentamento docente diante dessas dificuldades,o presente artigo tem como objetivo descrever as acoes realizadas no ambito do projeto integrador do segundo semestre de 2021  licenciatura a realizacao de um plano de aula voltado aos estudantes do nonooitavo ano do ensino fundamental norteou essa pesquisa que envolveu a analise de diversas redacoes desenvolvidas por estudantes com tema especifico entrevista com o docente marcio gaudereto coutinho o levantamento bibliografico e os processos utilizando a metodologia design thinking o processo de coleta das redacoes foi feito remotamente com reunioes entrevistas e envio feito eletronicamente todas as redacoes sem excecao mostraram erros ortograficos e de concordancia de maneira que todos os membros do grupo tem em comum acordo que isso pode ser corrigido no entanto verificouse outro problema que pode estar levando os discentes a procrastinar o desenvolvimento da sua capacidade em redigir textos a dificuldade em encadear as ideias com coerencia e coesao nas redacoes nao e feito o uso de paragrafos de maneira que as ideias sao colocadas sem encadeamento logico para isso elaborou se um plano de aula onde apos explicacao do docente sobre coerencia e coesao os alunos refizeram suas redacoes analisando eles mesmos o que pode ser mudado e melhorado no texto apos a aula foi feita a analise das redacoes nas quais se observou melhora significativa nas producoes dos alunos,reescrita,docencia,anos finais do ensino fundamental,dissertativo argumentativo,enem
04042023 214401,eixo tematico 2  o professor a docencia e as suas praticas pedagogicas no contexto das tdic,diversao e diversidade com o aplicativo jogo da onca,resumo o presente texto tem como objetivo apresentar o jogo da onca e uma versao online dele por meio de aplicativo este jogo remonta a portaria n 7240 que institui o programa jogos de tabuleiro nas unidades educacionais do municipio de sao paulo os jogos incluidos por esta medida sao jogo da onca mancalaawele jogo de go e xadrez especificamente o jogo da onca tem origem indigena e sua presenca na rede municipal de ensino vem a atender a lei 11645 de 2008 que institui a obrigatoriedade da tematica historia e cultura afrobrasileira e indigena na educacao basica em meio ao distanciamento social causado pela pandemia de covid19 minha pratica de ensino presencial do jogo da onca em uma escola paulistana teve de ser suspendida assim pretendeuse demonstrar uma maneira de se divertir com o jogo de maneira individual via aplicativo para celular,jogo da onca,lei 11645,cultura indigena,nd,nd
04042023 214530,eixo tematico 2  o professor a docencia e as suas praticas pedagogicas no contexto das tdic,docencia em tempos de educacao digital o que podemos aprender com o designer educacional,os desafios que as tecnologias digitais imputam aos docentes atualmente e que foram acelerados
pela pandemia por covid19 tem promovido transformacoes na educacao em todos os niveis do
ensino infantil ao superior docentes estao a todo momento se relacionando com tecnologias digitais
de informacao e comunicacao tdics e muitas vezes sem formacao digital adequada este trabalho
e um relato de experiencia sobre um projeto de formacao tecnologica realizada com docentes da
universidade de sao paulo com o objetivo de aprimorar conhecimentos dos docentes acerca do design
educacional especialmente o modelo addie a fim de dar suporte aos docentes na criacao
desenvolvimento e avaliacao de disciplinas oferecidas com o apoio da plataforma moodle como
resultado foram observados a continua aplicacao dos conceitos e o aprimoramento dos ambientes
virtuais de aprendizagem dos docentes participantes do curso o estudo apresentou reflexoes no que
se refere a atuacao docente e a conscientizacao da transformacao de suas atividades nao apenas
frente as tecnologias e inovacoes mas principalmente em relacao ao processo de aprendizagem de
seus estudantes,educacao 40 design educacional,modelo addie,ambientes virtuais de aprendizagem,nd,nd
04042023 214716,eixo tematico 2  o professor a docencia e as suas praticas pedagogicas no contexto das tdic,docentes paraguayos ante los desafios de la ensenanza remota durante la pandemia del covid19,el covid19 irrumpio drasticamente la educacion a nivel mundial las tecnologias de la informacion y de la comunicacion fueron las aliadas mas cercanas con las que se contaba para proseguir con la educacion en todos los niveles y en todo el mundo el proposito de este trabajo es mostrar algunas experiencias de los docentes paraguayos durante los dos ultimos anos de pandemia los datos fueron recolectados al inicio del confinamiento en 2020 y en los dos ultimos meses del mismo ano y del 2021 los resultados sugieren una accesibilidad importante a la tecnologia como computadoras e internet tambien un uso masivo de la mensajeria whatsapp y plataformas digitales como medios principales de comunicacion en todos los niveles educativos se detectaron problemas asociados a internet a pesar de que la gran mayoria de los docentes reportaron contar con servicios ilimitados ademas de surgir dificultades con el acompanamiento por parte de los estudiantes sin embargo un aspecto descubierto en el estudio muy importante y que en cierta medida se esperaba es que la mayoria de los docentes aumentaron sus niveles de competencias relacionadas al uso de las tic al estar conviviendo de cerca con estas herramientas durante mucho tiempo se espera que de ahora en mas se haga un mayor esfuerzo para involucrar con mayor frecuencia estas tecnologias a la educacion normal,covid19,educacao a distancia,professores,experiencias,nd
