carimbo de datahora,eixo tematico,titulo do trabalho,resumo,palavrachave 1,palavrachave 2,palavrachave 3,palavrachave 4,palavrachave 5
17032023 224637,eixo tematico 1  o estudante eou sua aprendizagem no contexto das tdic,minecraft e organizacao espacial a partir da imigracao no brasil,atualmente no contexto tecnologico temse falado muito na tecnologia metaverso ela nao e uma tecnologia tao nova pois ha decadas que alguns dos metaversos tem sido utilizados para diferentes atividades na educacao tais como games simcity second life activeworlds etc contudo qual o seu potencial para o desenvolvimento de praticas pedagogicas que possibilitem a autoria e o protagonismo dos estudantes neste relato de experiencia os autores irao descrever uma pratica realizada em um colegio privado com os estudantes de uma turma do 5 ano do ensino fundamental e na area de humanas com o desenvolvimento da pratica foi evidenciado que tanto para os educadores quanto para os estudantes houve uma experiencia tecnologica com potencial pedagogico muito significativo alem disso a colaboracao proporcionou a aprendizagem entre estudantes com menos fluencia tecnologica e que o ensinar e o aprender sao processos compartilhados entre todos os envolvidos na experiencia,metaverso,ensino fundamental,ciencia humanas,nd,nd
17032023 224800,eixo tematico 1  o estudante eou sua aprendizagem no contexto das tdic,modelo pedagogico para construcao de competencias digitais de alunos na educacao a distancia,o presente artigo trata de um estudo para definicao de um modelo pedagogico mp baseado em competencias digitais cd na educacao a distancia ead a pesquisa de abordagem qualitativa foi realizada em tres etapas 1 revisao teorica e analise de trabalhos em nivel nacional e internacional 2 estudo de caso a partir de um curso com docentes da ead e 3 definicao do modelo pedagogico a partir do cruzamento e analise dos dados na etapa 1 estabeleceramse as definicoes dos conceitos de modelos pedagogicos competencias digitais e ead na 2 atraves de um curso de extensao foi realizada a coleta de dados possibilitando a identificacao do perfil dos docentes da ead e a definicao de mp com base em competencias digitais por fim na tapa 3 a partir do cruzamento de dados definiramse parametros para auxiliar na construcao de mp baseado em competencias digitais na ead,competencias digitais,educacao a distancia,alunos,modelo pedagogico,nd
17032023 224923,eixo tematico 1  o estudante eou sua aprendizagem no contexto das tdic,multiletramentos web 20 e pbl uma contribuicao ao processo de alfabetizacao cientifica em geografia,neste artigo apresentaremos os resultados iniciais da pesquisa de mestrado que esta em andamento na universidade federal de sao paulo unifesp cujo objetivo e verificar e analisar a aprendizagem de geografia gerada nos alunos com uma sequencia didatica estruturada na metodologia da aprendizagem baseada na resolucao de problemas pbl ou abrp neste estudo articulamos os conceitos da web 20 santaella 2014 multiletramento rojo 2017 ao pbl leite e afonso 2001 e leite e esteves 2005 realizamos levantamento bibliografico na plataforma eric e revisao de documentos oficiais que norteiam a educacao basica brasileira a fim de auxiliar na elucidacao dos caminhos estruturados em nossa pesquisa as pesquisas realizadas ate o momento permitemnos entender a web 20 como um espaco amplo e complexo dos recursos digitais e atrelado a isso identificar a contribuicao dos multiletramentos no processo da alfabetizacao cientifica em geografia,multiletramentos,alfabetizacao cientifica,ensino de geografia,aprendizagem baseada na resolucao de problemas,web 20
17032023 225333,eixo tematico 1  o estudante eou sua aprendizagem no contexto das tdic,nada sera como antes a reinvencao do ensino superior na era da virtualidade  apontamentos a partir de constatacoes empiricas,no mundo contemporaneo nao faz mais sentido opor ensino presencial ao remoto a pandemia de covid19 precipitou o que ja vinha se verificando desde meados dos anos 1990 a virtualizacao das relacoes pessoais e de aprendizagem essa virtualizacao do ensino entretanto faz sentido somente se ela superar os vicios da educacao presencial que se limita a transmitir conteudos e cobralos em provas ou exames uma nova universidade atualizada com a tecnologia da informacao exige uma novoa professora aptoa a ensinar a aprender  e nao a apenas reproduzir conteudos prontos e impensados as condicoes objetivas para que o ensino hibrido aconteca estao dadas conforme verificamos em pesquisa empirica realizada no segundo semestre de 2020 na universidade federal fluminense defendemos neste artigo o apagamento da fronteira entre presencial e virtual propondo uma universidade inventiva criativa intelectualmente estimulante que faca tanto oa professora quanto oa alunoa protagonistas do conhecimento anteriormente a adesao apressada as inovacoes tecnologicas portanto e preciso decidir que universidade queremos antes que essa decisao seja tomada por quem nao estima a autonomia dela,universidade,virtualidade,ensino,tecnologia,nd
17032023 225521,eixo tematico 1  o estudante eou sua aprendizagem no contexto das tdic,objeto de leitura gamificado para alunos do 6 ano do ensino fundamental,este estudo de natureza qualitativa apresenta um recorte de uma pesquisa de iniciacao cientifica conduzida em um processo metodologico de estudo de caso que envolveu desenvolvimento e testagem de um objeto de leitura gamificado amparase teoricamente em estudos sobre gamificacao busarello 20016 kapp 2013 leitura kleiman 2008 koch elias 2011 e objetos digitais de aprendizagem wiley 2010 nessa investigacao estabeleceuse como principal objetivo desenvolver testar e avaliar objeto digital de leitura gamificado com recurso ao powerpoint como ferramenta de aprendizagem de leitura apos o processo de concepcao desenho e criacao o objeto foi testado com alunos do 6 ano de uma escola estadual do municipio de belempara com suporte da docente de lingua portuguesa em todo o processo de investigacao foram usados instrumentos para registro de dados como diario de campo fichas de validacao e para testagem gravacao em video e avaliacao por meio de questionario baseado em escala como principais resultados apresentados neste trabalho destacamos a identificacao de tipos de dificuldades como hesitacao pausas entre palavras dentre outras que promovem problemas na fluencia e na compreensao leitora,gamificacao,objeto de leitura gamificado,aprendizagem de leitura,nd,nd
17032023 225635,eixo tematico 1  o estudante eou sua aprendizagem no contexto das tdic,o ensino hibrido no ensino de biologia demandas e propostas no seculo xxi breve revisao bibliografica,o ensino tradicional ha muitos anos tem sido o principal metodo de ensino nas escolas os problemas decorrentes desse metodo sao incapazes de suprir as demandas carregadas pela escola na formacao do alunado alem disso as dificuldades que os professores de biologia encontram em sala de aula somamse aos problemas da utilizacao de aulas expositivas que nao trazem os estudantes ao centro do processo de aprendizagem para buscar transcender aos problemas levantados este trabalho propoe a utilizacao das metodologias ativas que focam na implementacao do ensino hibrido os pilares da educacao e as competencias do professor para o seculo xxi sao apresentados como pontos a serem atingidos para a garantia da qualidade da educacao por meio da utilizacao das metodologias ativas que tem como definicao metodos colocam o estudante como protagonista ativo e critico em seu aprendizado quanto ao ensino hibrido podese mencionar como um dos principais beneficios a personalizacao do ensino tornando possivel que os estudantes alcancem seus objetivos atraves de diferentes caminhos nao obstante essa metodologia ativa foi impulsionada devido as situacoes vividas com a pandemia do covid19 foram encontrados trabalhos com ferramentas que podem ser uteis na aplicacao do ensino hibrido em sala de aula dentre elas aplicacoes digitais instrucao por pares juntamente com ensino sob medida esses sao meios pelos
quais o professor de biologia pode abordar suas aulas,ensino hibrido,metodologias ativas,ensino de biologia,nd,nd
17032023 225820,eixo tematico 1  o estudante eou sua aprendizagem no contexto das tdic,o ensino remoto emergencial no colegio de aplicacao da universidade federal de roraimadesafios da educacao basica,a implementacao do ensino remoto emergencial no ambito do colegio de aplicacao que faz parte da universidade federal de roraima foi a alternativa encontrada institucionalmente para cumprir o que determinou o governo federal durante o periodo de marco de 2020 a marco de 2022 este trabalho tratase de um relato de experiencia dos docentes de educacao fisica que atuaram na educacao basica desde os anos iniciais do ensino fundamental ate as series do ensino medio o foco deste relato sao os desafios encontrados durante a pandemia de covid19 e as formas encontradas para transpolos com o objetivo de evidenciar os diferentes processos superados pelos estudantes durante o distanciamento social com uma abordagem qualitativa por meio da analise documental e bibliografica do recorte temporal supracitado os professores oferecem a comunidade academica sua percepcao sobre o impacto no processo de construcao de conhecimento por parte dos discentes para contextualizacao das tdics utilizouse matta furlani e santos 2019 nesse periodo o uso das tecnologias digitais de informacao e comunicacao foram essenciais para garantir o acesso de todos os estudantes ao ensino ofertado pelo colegio,tdics,colegio de aplicacao,ensino remoto emergencial,pandemia,nd
17032023 230028,eixo tematico 1  o estudante eou sua aprendizagem no contexto das tdic,o professor de matematica e o estudo de fracao entendendo a equivalencia para somar e subtrair,o trabalho propoe o ensino de fracoes em uma aula experimental desenvolvida no doutorado na disciplina de tecnologias de informacao e comunicacao no ensino de ciencias e matematica da universidade franciscana de santa maria  rs  utilizando como estrategia a resolucao de problemas atraves do uso das tecnologias o objetivo foi sugerir maneiras pelas quais os professores de matematica possam introduzir a problematica da equivalencia de fracoes facilitando as operacoes de soma e subtracao com denominadores diferentes alem da analise das estrategias de ensino atraves do uso de tecnologias estimulando a capacidade de compreensao e justificando a aplicacao da aprendizagem no processo de ensino na resolucao de problemas sendo importante o papel do professor como mediadororientador no processo de ensino para a apresentacao e discussao das estrategias utilizadas pelos estudantes a metodologia utilizada foi a de abordagem baseada na resolucao de problemas partiuse dos prerequisitos que os estudantes tinham conhecimento basicos para adicionar e subtrair fracoes com denominadores diferentes o estudo contem a descricao da aplicacao experimental da proposta realizada no 6a ano da educacao basica da rede publica estadual da cidade de cachoeira do sul  rs nos 1o e 2o semestre de 2021 onde apresentamos algumas consideracoes do trabalho desenvolvido na pandemia de covid19 de forma hibrida sendo imprescindivel o uso das tecnologias na realizacao da proposta,fracao  equivalente,tecnologias,ensino hibrido,aprendizagem,resolucao  de problemas
17032023 230130,eixo tematico 1  o estudante eou sua aprendizagem no contexto das tdic,orientacao educacional reinvencao em tempos de pandemia,este trabalho tratase de um estudo de caso yin 2015 realizado com 24 orientadores educacionais oe que atuam na educacao basica no estado do rio grande do sul o objetivo desta pesquisa foi investigar como a orientacao educacional oe um importante setor de apoio nas escolas vem se constituindo ao longo das decadas enfatizando o ano de 2020 marcado pela pandemia do covid19 nesse periodo houve a necessidade de mudancas rapidas no ambito da educacao devido ao fechamento das escolas com esse quadro as escolas precisaram se modificar e inclusive os oe esse ponto nos conduz ao problema de pesquisa que e verificar como os oe se reinventaram nesse periodo de pandemia para a continuidade de suas praticas para tanto utilizouse como instrumento de pesquisa um questionario online disponibilizado atraves do google forms os dados foram analisados a luz da analise de conteudos de bardin 2011 como resultados destacase a importancia do trabalho do oe junto aos estudantes professores e equipe diretiva bem como a importancia do uso das tecnologias durante esse periodo assim como suas contribuicoes apos a abertura das instituicoes escolares,orientador educacional,tecnologias,covid19,nd,nd
17032023 230227,eixo tematico 1  o estudante eou sua aprendizagem no contexto das tdic,orientador educacional alternativas em tempos de pandemia,esta pesquisa objetivou investigar as praticas dos orientadores educacionais no periodo da pandemia do covid19 a pandemia exigiu reformulacoes de todos os contextos inclusive da educacao e os profissionais precisaram modificar a forma com que vinham atuando ate entao um dos pontos que se observou foi a incorporacao do uso das tecnologias para a continuidade dos processos de ensino e aprendizagem e a manutencao de vinculos busca ativa apoio socioemocional entre outras para tanto o papel do oe se fez primordial frente ao novo contexto e precisou adequar as suas praticas ao mundo online a metodologia adotada foi o estudo de caso yin 2011 no qual foi investigado um universo de 19 de trabalhos de conclusao de curso de especializacao em orientacao educacional que analisaram diversas praticas de orientadores em tempos de pandemia os resultados apontam o trabalho do orientador educacional como um elemento integrador dentro e fora dos muros escolares atento as novas demandas e agindo como promotor de modificacoes de acordo com o contexto vivenciado tendo incorporado as tecnologias as suas praticas,orientacao educacional,tecnologias,pandemia,nd,nd
17032023 230434,eixo tematico 1  o estudante eou sua aprendizagem no contexto das tdic,o desafio da educacao digital no contexto pandemico relatos da universidade estadual de ponta grossa,a pandemia pelo novo coronavirus provocou um cenario inedito de isolamento social que deu origem a mudanca para o ensino remoto os docentes precisaram atualizar o conhecimento nas ferramentas tecnologicas e muitas vezes encontram dificuldades na transicao inesperada do ensino presencial para o ensino remoto que baseiase no uso de tecnologias desde a preparacao da disciplina ate o contato com os alunos assim este trabalho tem como objetivo levantar as possibilidades e limitacoes da insercao de tecnologias remotas na realidade dos cursos presenciais da universid metodo de pesquisa utilizou suporte teorico para o entendimento pandemico ainda utilizamos uma pesquisa qualitativa meio do qual conseguimos verificar que as tics foram fundamentais para o processo de implementacao do ensino remoto onde se destacaram as dificuldades em estrategias de ensino digital e elaboracao de ativida opiniao dos docentes,educacao digital,tecnologia,pandemia,ensino remoto,ead
17032023 230606,eixo tematico 1  o estudante eou sua aprendizagem no contexto das tdic,os desafios da escola para a promocao da inclusao digital uma breve revisao de literatura,este ensaio teorico tem como objetivo trazer reflexoes sobre os desafios da educacao para a promocao da inclusao digital estabelecendo relacoes entre avancos tecnologicos educacao e inclusao iniciaremos com uma breve reflexao sobre o avanco das tecnologias digitais das tecnologias da informacao e comunicacao e os beneficios e impactos na composicao de cenarios desiguais da sociedade contemporanea da mesma forma analisaremos brevemente as transformacoes nos meios de comunicacao e no conhecimento que trouxeram a necessidade de desenvolvimento de novas aprendizagens ampliando a concepcao de letramento e consequentemente o surgimento de iletrados digitais as reflexoes avancam para o acirramento da desigualdade durante o isolamento social na pandemia trazendo dificuldades para a continuidade dos estudos das populacoes mais vulneraveis e ao mesmo tempo perspectivas para conexao entre educacao e tecnologias a analise deste panorama nos levou ao estabelecimento da relacao entre educacao e inclusao digital entre as forcas que dificultam o avanco da inovacao na educacao mas que evidenciam a necessidade de promocao de processos educativos que favorecam o desenvolvimento da cultura digital contribuindo para a construcao de cenarios mais justos,inclusao digital,educacao e tecnologias,letramento digital,nd,nd
17032023 230721,eixo tematico 1  o estudante eou sua aprendizagem no contexto das tdic,os desafios do atendimento educacional especializado aee em tempos de pandemia do covid19 no municipio de uberlandiamg,o presente relato objetivou apresentar a experiencia de uma professora do atendimento educacional especializado aee com uma crianca de oito anos diagnosticada com o transtorno do espectro do autismo tea no ensino remoto utilizando recursos das tdic o tea faz parte do publico da educacao especial pee e o aee e um servico garantido por lei a estes alunos a pandemia de covid19 exigiu inovacoes por parte das escolas que tiveram que realizar aulas de forma remota exigindo a utilizacao de recursos tecnologicos para tal no aee nao foi diferente a experiencia aqui relatada se iniciou em maio de 2021 sendo que a primeira dificuldade encontrada pela professora foi conhecer a crianca de forma remota os recursos disponibilizados para o aee foram a videoconferencia pela plataforma google meet ou video chamada pelo whatsapp entretanto ambas alternativas nao atenderam a realidade familiar o que gerou um desgaste na familia e a falta de credibilidade no processo de ensino e aprendizagem da crianca dessa forma o relato corroborou pesquisas que apontaram que a falta de acesso tecnologico por parte das familias dificultou demasiado o alcance desses estudantes ao ensino remoto e a inclusao educacional,atendimento   educacional   especializado,tecnologias digitais da informacao e comunicacao,transtorno do espectro do autismo,nd,nd
17032023 230827,eixo tematico 1  o estudante eou sua aprendizagem no contexto das tdic,o uso da internet na autorregulacao da aprendizagem de instrumentos musicais um estudo de caso,o artigo a seguir apresenta um recorte de uma pesquisa maior que teve como finalidade investigar estrategias de aprendizagem musical em uma banda de musica escolar a referencia teorica da pesquisa foi a autorregulacao da aprendizagem zimmerman 1998 2000 2005 a metodologia de pesquisa foi um estudo de caso com coleta de dados por meio de observacoes de aulas e ensaios alem de entrevistas semiestruturadas com alunos e professor dentre as estrategias autorregulatorias identificadas a realizacao de buscas por videos e outros materiais na internet teve funcao de destaque,musica,autorregulacao,aprendizagem,estrategia,banda escolar
17032023 230929,eixo tematico 1  o estudante eou sua aprendizagem no contexto das tdic,o uso de historia em quadrinhos como recurso pedagogico para a sistematizacao dos conhecimentos no ensino hibrido,este artigo tem por objetivo descrever uma pesquisa que teve como objetivo investigar a possibilidade de sistematizacao da aprendizagem sobre alimentacao saudavel a partir da criacao de historias em
quadrinho pelos estudantes participaram dessa pesquisa 32 alunos do ensino medio de uma escola estadual do interior de sao paulo para a coleta de dados utilizamos as historias em quadrinhos desenvolvidas no componente curricular eletiva tratase de uma pesquisa qualitativa do tipo estudo de caso e foi desenvolvida durante o ensino hibrido que foi aplicado como forma de seguir os protocolos sanitarios de prevencao a covid19 durante o ano de 2021 os alunos utilizaram o aplicativo bahraniapps para a construcao de suas historias em quadrinho um blog e o aplicativo whatsapp para tirar duvidas com a professora os resultados evidenciaram que as historias em quadrinhos foram importantes para a sistematizacao dos conhecimentos e auxiliou os discentes no processo de aprendizagem no periodo de isolamento social,alimentos organicos,eletiva,historia em quadrinhos,nd,nd
17032023 231104,eixo tematico 1  o estudante eou sua aprendizagem no contexto das tdic,pandemia e ensino remoto a defasagem na aprendizagem de matematica no ensino medio,a suspensao das aulas presenciais imposta pela pandemia da covid19 implicou na adequacaorevisao dos curriculos dos processos formativosdidaticos e avaliativos nas escolas da educacao basica consequencia da implementacao de um modelo de ensino remoto emergencial no periodo pos pandemico as aulas retornaram ao modelo presencial expondo as marcas desta experiencia que teve duracao de dois anos assim este artigo busca apresentar os impactos deste fenomeno propondo uma investigacao exploratoria descritiva e analitica dos resultados do sistema de avaliacao de rendimento escolar do estado de sao paulo saresp advindos da aplicacao de provas em estudantes da 3a serie do ensino medio na disciplina de matematica em 2021 por meio de revisao bibliografica foram compartilhados estudos envolvendo as tematicas que cercam o problema de pesquisa motivacoes e dificuldades para a adesao ao ensino remoto bacich e moran 2018 benedito e filho 2020 dentre outros as analises preliminares indicam que o estudante da 3a serie do ensino medio terminou o ciclo com uma proficiencia em matematica equivalente a de um estudante do 7o ano do ensino fundamental ou seja com uma defasagem de quase seis anos a media de conhecimento na materia foi de 264 pontos uma queda expressiva de 13 pontos em relacao ao resultado de 227 pontos obtidos em 2019,ensino remoto,tecnologia   digital de informacao e comunicacao tdic,aprendizagem em matematica,educacao basica,covid19
17032023 231200,eixo tematico 1  o estudante eou sua aprendizagem no contexto das tdic,protagonismo discente e as tdics resiliencia em uma experiencia academica,resumo no contexto da pandemia da covid19 emergiu a necessidade de pensarmos em formas de ressignificar a presencialidade uma vez que nao poderiamos dar continuidade ao processo de ensino e aprendizagem estando docentes e discentes no mesmo espaco fisico entao nesse contexto a partir da publicacao de textos legais que versavam sobre as possibilidades de ferramentas que pudessem oportunizar essa continuidade as instituicoes de ensino superior propuseram um ensino mediado pelas tecnologias digitais de informacao e comunicacao tdics o presente texto objetiva compartilhar um relato de experiencia academica que tece reflexoes acerca do protagonismo discente em contextos de aprendizagem mediados pelo uso das tdics elencamos o relato de experiencia e adotamos a pesquisa bibliografica para essa construcao textual em nossas consideracoes finais consideramos que o protagonismo discente relatado nesse texto podera contribuir para que as tdics permanecam em ambiente educacional e sejam compreendidas como recursos que viabilizam o protagonismo discente,discente,ensino superior,protagonismo,tdics,nd
17032023 231322,eixo tematico 1  o estudante eou sua aprendizagem no contexto das tdic,retorno as atividades presencias na rede estadual de sao paulo desafios e perspectivas em tempos de pospandemia,este artigo explora aspectos da pandemia causada pela covid19 na rede estadual de educacao de sao paulo propondo uma analise comparativa de resultados de dados coletados pela secretaria estadual de educacao see em duas formas 1 saresp e 2 pesquisa de avaliacao realizada pelo centro de politicas publicas e avaliacao da educacao da universidade federal de juiz de fora caedufjf o processo metodologico se propos a comparar as proficiencias de estudantes  5 e 9 ano do ensino fundamental e 3 serie do ensino medio  com os resultados obtidos nas provas elaboradas pelo sistema de avaliacao da educacao basica saeb que avaliaram os estudantes das mesmas etapas de escolarizacao entre 2017 e 2019 o objetivo do estudo e apoiar as escolas no retorno as aulas presenciais subsidiando as tomadas de decisoes que cercam o desempenho escolar nas disciplinas de lingua portuguesa e matematica outro destaque se dara aos apoios materiais e ferramentas que a see disponibilizou no periodo pandemico para tanto teve como base as reflexoes de schleicher 2020 santos e sabia 2015 moran 2017 com os resultados preliminares foi possivel aferir que apesar de significativos tais apoios se mostraram insuficientes para atender a demanda pois poucos alunos tiveram acesso a eles causando mais desigualdades e defasagem na formacao dos estudantes,avaliacao,educacao basica,saresp,tdic,nd
