carimbo de datahora,eixo tematico,titulo do trabalho,resumo,palavrachave 1,palavrachave 2,palavrachave 3,palavrachave 4,palavrachave 5
15032023 121604,eixo tematico 1  o estudante eou sua aprendizagem no contexto das tdic,1alfabetizacao atraves do ensino remoto emergencial na pandemia de covid19 um estudo de caso,com a chegada do novo coronaviruscovid19 e no formato de distanciamentoisolamento social as modificacoes  tambem  se  deram  no  ambito  do  processo  de ensinoaprendizagem  ou  seja  do presencial ao online e no formato de ensino remoto emergencial ere o presente artigo e parte de uma pesquisa em umauniversidade publicaque aborda aprendizagens e tecnologias digitais tratase de uma pesquisa qualitativa no formato de estudo de casocujo foco foi a alfabetizacao de um aluno pertencente ao primeiro ano dos anos iniciais de uma escola publica estadual o campo empirico foi a interacao do aluno nos recursos disponiveis pela escolagoogle meet google classroom atividades em google formulario o uso do jamboard videos com jogos de alfabetizacao no youtube e projeto de aprendizagemonlinee o diario de campo da professora o referencial teorico que norteou a proposta e a coleta de dados foia epistemologia genetica de piagete as pesquisas deemilia ferreiro relativas a alfabetizacaoo estudo apontou que e possivel obter a alfabetizacao de forma online com o auxilio de  recursos  tecnologicos  apoio  familiar  uma  proposta  pedagogica  interativa  sequencia  didatica  e planejamento antecipado,alfabetizacao,ensino  remoto  emergencial,ensino  fundamental,tecnologias  da informacao e comunicacao,nd
15032023 121832,eixo tematico 1  o estudante eou sua aprendizagem no contexto das tdic,amemoria sensorial e as mudancascerebraiscom a utilizacao da tdicpara a aprendizagemescolar,o presente trabalho investigou o impacto cerebral do processo de aprendizagem por meio do estimulo da memoria sensorial e do uso de tecnologias digitais de informacao e comunicacao tdic a partir do  olhar da neurociencia  a  metodologia utilizada  foi  de  pesquisa bibliografica  e  as  obras  utilizadas foram  interdisciplinares  poisa  investigacao  buscou  contemplar  a  perspectiva  neurocientifica  e pedagogica  por tratarse de um trabalho resumido foram destacados os principais pontos do estudo que ainda e embrionario e as conclusoes ate o momento direciona para a necessidade de amplitude do  estimulo  da  memoria  para  acelerar  a  aprendizagem  aumento  do  uso  do  ciberespaco  e  de ferramentas digitais contudo  deve sempre  haver uma  concentracao na atencao do  estudante  pois tecnologias conectadas a internet aumentam o estimulo da aprendizagem mas tendem tambem a ocasionar distracoes por fim o trabalho vislumbra na escola um espacopara o desenvolvimento da memoria  na sociedade  digital  com um  papel  transformador de  tornar  esse  ambiente  cada  vez  mais abertoecooperativopara o compartilhamento de informacoes e de conhecimentossem se limitar as quatro paredes dada as ferramentas de acesso ao mundo,memoria,tdic,neurociencia,aprendizagem,nd
16032023 132232,eixo tematico 1  o estudante eou sua aprendizagem no contexto das tdic,analise da acessibilidade tecnologica dos estudantes de um instituto federal desafios para implementacao do ensino remoto emergencial,o presente  trabalho tem  como  objetivo principal  apresentar  uma pesquisa sobre  acessibilidade  digital no contexto  da pandemia  que foi realizada  durante  o ano de 2020 em  um campus  do instituto  federal  do rio de  janeiro  ifrj  a pesquisa foi fundamentada  em um  questionario  aplicado a 700 estudantes  do  ensino  medio  tecnico  a  partir  dessas  respostas  foi  desenvolvida  uma  analise  critica  acerca  dos aspectos  do acesso as tecnologias digitais levantando questoes  a respeito  da qualidade e formas  como se  deu a  comunicacao  entre  professores  e  estudantes  durante  o periodo  de suspensao  das atividades presenciais  apesar  de  69  dos  participantes  informar  que  possui  pacote  de  dados  ilimitados  para acesso  a internet  por dados moveis  observouse  que essa  pode ter  sido umaresposta  equivocada pois uma parte  consideravel  dos estudantes  possuia acesso  ilimitado  apenas a aplicativos  de mensagens  e redes  sociais  como  costuma  ser  oferecido  em  planos prepagos  em  relacao  as  estrategias  adotadas pelo ifrj  foram  lancados 6 editais  com oferta  de kit acessibilidade  sendo apenas 2 desses  editais  com oferta  de tablets  a implementacao  das atividades pedagogicas nao presenciais  apnps evidenciou as desigualdades  sociais   que  se  refletem   nos  aspectos   de  inclusao  digital  e  qualidade  de  ensino aprendizagem,acessibilidade digital,inclusao digital,ensino remoto emergencial,atividades pedagogicas nao presenciais,nd
17032023 110015,eixo tematico 1  o estudante eou sua aprendizagem no contexto das tdic,analise de desigualdades educacionais e sociais no contexto pandemico e de cultura digital decorrencias do ensino remoto para jovens do ensino medio publico,esta pesquisa busca analisar e compreender as  implicacoes do ensino remoto constituido no contexto pandemico  e  de  cultura  digital sobre o ensino  medio  publico em  termos   das   desigualdades  educacionais e sociais na regiao norte do estado do tocantins esta pesquisa tem fundamentacao teoricometodologica na pesquisa qualiquantitativa de abordagem historicodialetica ela esta realizada em seis escolas em tres   municipios do tocantins para tanto esta sendo realizado uma revisao sistematica da literatura sobre a tematica uma pesquisa documental coleta de dados com observacaoparticipante entrevistas aplicacao de questionarios com perguntas abertas e fechadasesperase que os dados  contribuam para entender melhor o fenomeno e auxiliarem futuras pesquisas que indiquem caminhos para orientar politicas educacionais que ajudem a superar dificuldades do ensino remoto e amenizar o agravamento das  desigualdades educacionais,ensino medio,ensino remoto,desigualdade educacional,cultura digital,nd
17032023 110154,eixo tematico 1  o estudante eou sua aprendizagem no contexto das tdic,analise do desenvolvimento educacional em tempos de pandemia ensino remoto emergencial no ifg itumbiara,o estudo do desenvolvimento educacional no periodo pandemico mediatizado pelo ensino remoto se faz importante para o entendimento de satisfacao dos discentes e levantamento de pontos negativos a serem melhorados assim neste estudo foi apresentado uma acao realizada pelo grupo pet quimica para analisar a satisfacao projecao futura e entendimento dos alunos sobre a modalidade remota de estudos que estavam utilizando para darem continuidade as suas aulas durante o periodo de isolamento social causado pela pandemia do covid19 para tanto fezse uso de um formulario criado no google forms como ferramenta de coleta de dados para a metodologia de estudo de caso os resultados apresentados retratam a insatisfacao dos estudantes com o espaco no qual desenvolviam suas atividades academicas durante as aulas remotas seja por conectividade ou autodisciplina perante a necessidade de adaptacao da nova rotina alem disso evidenciouse o aumento das desigualdades de ensino entre estudantes de diferentes realidades socioeconomicas de forma positiva podemos apontar os avancos quanto ao uso das tecnologias em sala de aula e como as tics se mostraram importantes meios para a continuidade da educacao mesmo com os desafios encontrados frente a pandemia,desenvolvimento educacional,ensino remoto,periodo pandemico,nd,nd
17032023 110640,eixo tematico 1  o estudante eou sua aprendizagem no contexto das tdic,1analise do perfil discente ingressante em 20211na ead da ufrn,este  trabalho  teve  como objetivo  analisar  o  perfil  discente  ingressante  nos  cursos  de  licenciatura  a distancia da ufrn no semestre letivo 20211para isso foram avaliados os questionarios respondidos por 887 discentes no momento do seu cadastro junto a instituicao os ingressantes tem idade media de 30 anosa maioria e do genero feminino 53 se identifica como como pardo ou mulato 49 e solteiro e nao possui filhos 63cursou o ensino fundamental 79e medio 87 em escola publica reside com os pais 46 no estado do rio grande do norte 96 essas informacoes sao essenciais para  subsidiar a tomada  de  decisao referente  ao  planejamento  das  proximas  ofertas  dos  cursos e replanejamento  das  acoes  pontuais  no  que  se  refere  ao  processo  de  ensino  e  aprendizagem possibilitando  que  se  torne  mais  adequado  e  proximo  das  especificidades  e  necessidades  dos  seus estudantesalem  disso provera informacoes  que  possam  subsidiar a  implementacao0 de  politicas publicas para a educacao a distancia considerando a realidade em que seu publicoalvo esta inserida,caracteristica,estudante,licenciatura,ensino e aprendizagem,nd
17032023 110801,eixo tematico 1  o estudante eou saua aprendizagem no contexto das tdic,apontamentos sobre a mediacao pedagogica na cultura digital uma breve revisao de literatura,este ensaio teorico tem como objetivo trazer uma breve contextualizacao sobre a mediacao pedagogica na cultura digital e refletir sobre aspectos positivos e limitantes que envolvem a tematica para isso tracamos uma breve conceitualizacao da tematica ponderamos sua importancia e indicamos os aspectos positivos no processo de ensino e aprendizagem por outro lado foram ressaltados alguns aspectos limitantes que dificultam a expansao e aceitacao da mediacao pedagogica atrelada aos dispositivos tecnologicos digitais no ambiente escolar e em seguida fezse uma breve reflexao da mediacao pedagogica no contexto pandemico a partir destas analises foi possivel identificar que a ausencia de processo formativo inicial e continuado aos professores para o uso das tecnologias digitais oriundo de resistencias historicas e o principal dificultador da adocao da mediacao pedagogica na cultura digital,mediacao pedagogica,cultura digital,formacao de professores,nd,nd
17032023 111054,eixo tematico 1  o estudante eou saua aprendizagem no contexto das tdic,aprendizados do ensino remoto emergencial e o retorno ao presencial flexibilizacao e autonomia na formacao de professores,o ensino nao presencial emergencial provocado pela pandemia de covid19 obrigou que disciplinas do curso de licenciatura em musica fossem adaptadas ao formato remoto essas disciplinas de carater pratico e vivencial precisaram ser revistas e replanejadas a fim de que seus conteudos pudessem ser abordados este artigo apresenta o relado de uma experiencia na qual as trilhas de aprendizagem a sala de aula invertida e os feedbacks figuraram como metodologias possiveis para o melhor aproveitamento dessas disciplinas a preocupacao em oferecer um ensino flexivel que despertasse a motivacao gerasse autonomia e valorizasse os estudantes como seres humanos foi imperativo e e reflexo do referencial teorico adotado autores como hansjoaquin koellreutter paulo freire e black boles fundamentaram essas escolhas sao apresentados os resultados dessa acao a partir da fala dos estudantes que demonstram que essas metodologias favoreceram a sua aprendizagem e o seu desenvolvimento humano e fizeram eles se sentirem valorizados a partir dessa experiencia se levantam questionamentos e reflexoes para pensar o retorno ao ensino presencial,ensino superior,trilha de aprendizagem,sala de aula invertida,feedback,formacao de professores
17032023 111215,eixo tematico 1  o estudante eou saua aprendizagem no contexto das tdic,aprendizagem baseada em projetos aplicada na modalidade de educacao de jovens e adultos estrategia motivacional e de transformacao da sociedade,o presente trabalho apresenta um relato de experiencia da aplicacao da aprendizagem baseada em projetos aplicada de forma interdisciplinar em um curso tecnico de guia de turismo na modalidade de educacao de jovens e adultos proeja o objetivo desta intervencao pedagogica foi de motivar os estudantes a participarem ativamente como coresponsaveis pelo seu processo de aprendizagem e contribuirem com projetos reais e significativos para a comunidade os resultados alcancados no desenvolvimento do produto final e no desenvolvimento de habilidades comportamentais nos estudantes e admiravel e animador principalmente diante da grande dificuldade de utilizacao de tecnologias educacionais por parte deste publico estudantil isso evidencia que a aprendizagem baseada em projetos tem um grande potencial para motivar os estudantes a estudarem a se envolverem ativamente no processo de aprendizagem e de desenvolver de forma profunda e pratica os conteudos das disciplinas alinhados as demandas do mundo real,proeja,turismo cientifico,informatica,nd,nd
17032023 111414,eixo tematico 1  o estudante eou saua aprendizagem no contexto das tdic,a realizacao do estagio supervisionado na educacao infantil mediado por tecnologias o desafio de ensinar e de aprender no contexto do ensino remoto emergencial,o estudo apresentado neste texto referese a uma pesquisa de campo que deu voz a uma turma do curso de pedagogia parfor que realizou estudos para a disciplina de estagio supervisionado tanto de modo presencial quanto por meio do ensino remoto emergencial o uso de tecnologias digitais na educacao permitiu a mediacao entre os conhecimentos teoricopraticos em um contexto pandemico trazendo desafios para a universidade e para as instituicoes de educacao infantil os objetivos da pesquisa foram identificar e contrapor as experiencias das academicas com o ensino presencial e o ensino remoto emergencial e relacionar os estudos teoricopraticos desenvolvidos na universidade com a realizacao do estagio na instituicao de educacao infantil via analise de conteudo de bardin 2016 os dados coletados por meio de questionarios foram categorizados e as analises apresentaram os principais resultados as academicas compararam os estudos presenciais e remotos com a ead distinguindoos e dependendo das condicoes particulares de cada uma entenderam que a qualidade do modelo presencial supera a das experiencias remotas e a distancia o estagio supervisionado enquanto acao pratica nas escolas junto das criancas foi muito fragilizado pelas condicoes impostas pelo contexto emergencial bem como a vivencia com as tecnologias digitais para fins educacionais permitiu uma nova visao sobre os processos de ensino e aprendizagem,estagio supervisionado,ensino remoto emergencial,educacao infantil,tecnologias,nd
17032023 111522,eixo tematico 1  o estudante eou saua aprendizagem no contexto das tdic,a relevancia do letramento digital no percurso do processo de ensino e aprendizagem na pandemia a realidade de minas gerais,o presente estudo analisa a relevancia do letramento digital no percurso do processo de ensino e aprendizagem no periodo da pandemia e notorio que todos os sistemas educacionais tanto das redes particulares quanto das publicas se reinventaram com a finalidade de atender os alunos durante quase dois anos na metodologia remota e posteriormente hibrida de maneira a oferecer possibilidades de aprendizagem frente as diversidades de realidades nesse sentido tanto professores quanto alunos passaram por esse processo de adaptacao onde inumeras metodologias foram validas enquanto que outras nao contribuiram significativamente ocasionando de tal forma prejuizos irreparaveis a aprendizagem a metodologia utilizada nesse trabalho teve como base a pesquisa qualitativa pois o texto teve como finalidade discutir a relevancia do letramento digital no percurso do processo de ensino e aprendizagem na pandemia no estado de minas gerais segundo coscarelli e ribeiro 2007 soares 2002 tapscott 1999 e possivel verificar quao grande a importancia da escola fazer das novas tecnologias reais instrumentos pedagogicos apostando na vivencia e na familiaridade com tais instrumentos como um diferencial no processo de formacao desses individuos enfim o letramento digital constituiu na pandemia e constitui num processo desafiador e requer que a escola a exemplo do periodo da pandemia repense o ensino e a possibilidade de letrar seus alunos sob a perspectiva da nova sociedade da informacao e aquisicao de novos conhecimentos,letramento digital,ensino e aprendizagem,pandemia,educacao basica,nd
17032023 111630,eixo tematico 1  o estudante eou saua aprendizagem no contexto das tdic,as metodologias de ensino e a autonomia do aluno na ead estudo de caso no curso de administracao publica da universidade estadual de ponta grossa,o professor contemporaneo deve conduzir os estudantes em um caminho em direcao ao saber fazer participar e colaborar os alunos devem estar inseridos nas disciplinas e trocar conhecimentos entre si e com o professor deste modo este trabalho propoe discutir e analisar o uso de tecnologias digitais de informacao e comunicacao tdics e o formato das disciplinas da educacao a distancia do curso de bacharelado em administracao publica da ponta grossa para isso serao levadas em conta as pesquisas de avaliacao aplicadas nas disciplinas do segundo semestre de 2021 a partir dessa analise sera verificado se esse curso trabalha somente com aulas expositivas ou se integra metodologias ativas de aprendizagem em suas disciplinas desse modo constatouse a necessidade do curso apresentar um curriculo inovador embora tenha verificado uma certa tendencia de utilizacao de metodologias ativas em algumas aulas,metodologias ativas de aprendizagem,administracao publica,tdics,nd,nd
17032023 111823,eixo tematico 1  o estudante eou saua aprendizagem no contexto das tdic,as redes sociais escolhidas por estudantes do ensino medio,este texto apresenta os resultados de um estudo realizado com a participacao de estudantes do ensino medio tecnico em uma instituicao publica dentro do contexto pandemico um levantamento de opinioes online foi adotado a fim de ter acesso as perspectivas dos estudantes de tres cursos a respeito de seus perfis digitais no que tange principalmente as redes sociais mais utilizadas para estudarem e aprenderem ingles durante o ano letivo de 2021 um dos objetivos foi o de compreender o comportamento digital do publicoalvo e com isso incentivar ensinoaprendizagem de ingles por meio das redes sociais de maior interesse dos alunos os resultados indicaram a importancia dessas redes para os estudantes e o interesse deles por algumas delas em detrimento de outras e tambem a necessidade de se fomentar a inclusao digital leffa 2016 letti 2013 coll  monereo 2010 vygotsky 1998,redes sociais,estudantes do ensino medio,ingles,nd,nd
17032023 111929,eixo tematico 1  o estudante eou saua aprendizagem no contexto das tdic,as tecnologias hipertextuais e a aprendizagem da leitura e da escrita na escola,o advento dos dispositivos hipertextuais na educacao tem gerado discussoes e por conseguinte originado um numero expressivo de pesquisas tratando do tema as modificacoes digitais impactam de forma cada vez mais profunda o cotidiano das pessoas outrossim e inegavel que ate o marco da pandemia de covid19 as implicacoes das ferramentas digitais na educacao se faziam bem mais limitadas que hoje com efeito as tecnologias hipertextuais em ambito escolar podem fomentar o processo de emancipacao social do individuo ao conceder infinitas possibilidades de escolhas sobre os caminhos da aprendizagem mas isso exige que as instituicoes de ensino disponham de competencias tecnicas e pedagogicas apropriadas assim objetivase neste trabalho tecer uma analise criticareflexiva acerca da utilizacao dos aparatos tecnologicos hipertextuais como elementos adjuvantes no desenvolvimento da leitura e da escrita a abordagem bibliografica foi escolhida para fundamentar o itinerario do artigo em linhas gerais o estudo revelou que os suportes tecnologicos hipertextuais podem potencializar ou mecanizar o sistema de apreensao de saberes a depender dos objetivos dos valores e dos contextos sociais nos quais estao inseridos,escola,leitura,escrita,tecnologias hipertextuais,nd
17032023 112125,eixo tematico 1  o estudante eou saua aprendizagem no contexto das tdic,a teoria da distancia transacional em discussao ressignificando as perspectivas de tempo e espaco,o presente trabalho discute a importancia de se adotar estrategias pedagogicocomunicacionais em cursos na modalidade a distancia de modo a tornar a experiencia de ensinoaprendizagem mais dialogica e diminuir a chamada distancia transacional sensacao comum em experiencias de ensino pouco voltadas para o dialogo e que tem sido responsavel por um alto indice de evasao em cursos virtuais a tematica apresentase cada vez mais relevante sobretudo se pensarmos que a modalidade a distancia esta cada vez mais presente em escolas e universidades o que foi exacerbado durante o periodo de isolamento social motivado pela pandemia de covid19 entre as estrategias utilizadas nessa modalidade de ensino analisaremos sobretudo os foruns e webconferencias ou lives como espacos de trocas entre estudantes e professores ou facilitadores valendonos dos trabalhos de otsuka pendenza zanotto 2010 zanotto kawakami e pendenza 2012 moore 2002 entre outros como estudo de caso eisenhardt 1989 yin 2009 mostraremos como essas estrategias se dao na univesp universidade virtual do estado de sao paulo instituicao de ensino criada em 2012 visando a universalizacao do ensino superior,distancia transacional,estrategias pedagogicocomunicacionais,univesp,ensino a distancia,nd
17032023 112229,eixo tematico 1  o estudante eou saua aprendizagem no contexto das tdic,atividades praticas e ensino de biologia no ensino remoto emergencial,o ensino remoto emergencial foi adotado por diversas escolas durante a pandemia de covid19 apesar de ter possibilitado a continuidade das atividades educacionais apresentou diversos problemas intrinsecos como a falta de motivacao dos estudantes devido ao distanciamento fisico de seus colegas e professores nesse contexto buscaramse formas de ensino que possibilitassem maior envolvimento dos estudantes este trabalho teve por objetivo avaliar se atividades praticas promoveriam melhoras na aprendizagem e maior envolvimento de estudantes do primeiro ano do ensino medio em aulas de biologia apos realizarem as atividades praticas propostas os estudantes revelaram por meio de um questionario que elas favoreceram o aprendizado de topicos especificos e aumentaram seu engaja mento com a disciplina portanto mesmo quando realizadas no ambiente domiciliar atividades praticas se apresentam como uma estrategia promissora para o processo de ensinoaprendizagem,ensino remoto emergencia,biologia atividades praticas,nd,nd,nd
17032023 112335,eixo tematico 1  o estudante eou saua aprendizagem no contexto das tdic,atualizacao e aprimoramento do website de um grupo de pesquisa,tratase de um relato de experiencia vivenciado por graduandas de enfermagem na atualizacao e no aprimoramento do website de um grupo de pesquisa em gerenciamento de servicos de enfermagem as atividades foram desenvolvidas no periodo entre abril de 2021 a marco de 2022 as alunas foram capacitadas pela doutoranda responsavel pelo website sobre o uso da plataforma digital bem como buscaram informacoes para atualizar e modernizar a apresentacao deste destacaram que participar dessas atividades oportunizou desenvolver competencias para o uso da plataforma de montagem e de manutencao do website integracao com os demais membros do grupo de pesquisa devido a necessidade de buscar informacoes atualizadas ressaltam que desenvolveram estrategias para contornar as dificuldades em obter informacoes atualizadas sendo necessario uma busca ativa e constante na plataforma lattes e nas redes sociais dos participantes do grupo de pesquisa para manter as informacoes no website interessantes para o leitor,tecnologia  da   informacao,informatica   em   enfermagem,grupos   de pesquisa,nd,nd
17032023 112442,eixo tematico 1  o estudante eou saua aprendizagem no contexto das tdic,avaliar para as aprendizagens em contextos digitais potencialidades e desafios no ambito de cursos de graduacao de engenharia,o ciberespaco e as tecnologias digitais em geral estao produzindo mudancas disruptivas em distintos contextos incluindo a educacao formal a conectividade o amplo acesso e a variedade de tecnologias digitais favorecem a integracao entre modelos de aprender e ensinar do ensino presencial e do ensino a distancia trazendo uma nova perspectiva para a educacao hibrida esse cenario pode catalisar mudancas nos modos ainda rigidos de avaliar em cursos de graduacao em engenharia a hipotese deste estudo e de que os contextos digitais facilitam a adocao de praticas avaliativas com foco em avaliar para as aprendizagens nas quais os feedbacks tem papel fundamental o objetivo ligado a essa hipotese visa examinar potencialidades e desafios de praticas de avaliacao mediadas por contextos digitais como estrategias que favorecem a autorregulacao das aprendizagens a pesquisa foi desenvolvida em uma universidade comunitaria do rio grande do sul com estudantes de duas turmas de fisica a geracao de dados ocorreu por meio de questionario online e feedbacks obtidos durante as aulas nas quais os estudantes se manifestaram sobre a assertividade das estrategias propostas pelos professores em geral os alunos avaliaram as diferentes estrategias como relevantes ou muito relevantes para a autorregulacao das aprendizagens com destaque para provas online experimentos virtuais rubricas e quizzes justintime,avaliacao,educacao hibrida,cultura digital,ensino de fisica,nd
